{
  "$schema": "gate-output-v1",
  "slice": "018",
  "gate": "plan-review",
  "lane": "L3",
  "agent": "architecture-expert",
  "mode": "plan-review",
  "verdict": "approved",
  "timestamp": "2026-04-18T09:15:00Z",
  "commit_hash": "51534cf",
  "isolation_context": "slice-018-plan-review-instance-01",
  "blocking_findings_count": 0,
  "non_blocking_findings_count": 0,
  "findings_by_severity": {"S1": 0, "S2": 0, "S3": 0, "S4": 0, "S5": 0},
  "findings": [],
  "evidence": {
    "checks": {
      "ac_to_module_mapping_complete": true,
      "alternatives_documented": true,
      "reversibility_declared": true,
      "adr_backed_where_needed": true,
      "adr_0001_consistency": true,
      "no_invented_requirements": true,
      "eager_loading_strategy_declared": true,
      "middleware_pipeline_explicit": true,
      "risks_with_mitigations": true,
      "cross_slice_dependencies_explicit": true,
      "migrations_safe_patterns": true,
      "controllers_are_routers": true,
      "sealed_files_respected": true,
      "dag_consistent": true,
      "tasks_atomic_with_mechanical_criteria": true,
      "principles_p1_p9_r1_r16_preserved": true
    },
    "acs_mapped_count": 14,
    "acs_total": 14,
    "decisions_count": 11,
    "tasks_count": 16,
    "decisions_without_alternatives": [],
    "decisions_without_reversibility": [],
    "acs_without_task_coverage": [],
    "acs_without_decision_coverage": [],
    "tasks_without_mechanical_criteria": [],
    "sealed_files_edited_directly": [],
    "summary": "Plan 018 aprovado: 14/14 ACs mapeados a decisões+tasks; 11 decisões com alternativas+reversibilidade; DAG coerente; selagem (merge-slice.sh) respeitada via manifesto T14/D8; enum canônico do schema confirmado em gate-output.schema.json; riscos R1-R7 com mitigações concretas; nenhum P1-P9/R1-R16 violado; slice operacionaliza R3/R11 sem revogar princípios."
  }
}
