{
  "$schema": "gate-output-v1",
  "gate": "audit-spec",
  "slice": "017",
  "lane": "L3",
  "agent": "qa-expert",
  "mode": "audit-spec",
  "verdict": "approved",
  "timestamp": "2026-04-17T22:00:00Z",
  "commit_hash": "2332c09",
  "isolation_context": "slice-017-audit-spec-instance-01",
  "blocking_findings_count": 0,
  "non_blocking_findings_count": 1,
  "findings_by_severity": {"S1": 0, "S2": 0, "S3": 0, "S4": 1, "S5": 0},
  "findings": [
    {
      "id": "F-001",
      "severity": "S4",
      "severity_label": "minor",
      "gate_blocking": false,
      "description": "AC-006 define threshold Lighthouse como 0.85 em CI enquanto o Story Contract E15-S03 define 0.90. A reducao e justificada inline (risco #2: variabilidade ±5 em CI) e documentada nas Notas do PM. Mas o contrato nao foi formalmente atualizado — existe divergencia documental entre spec e Story Contract. Nao bloqueia pois a justificativa tecnica e solida e o gap esta documentado; recomenda-se atualizar E15-S03 para alinhar threshold CI=0.85 / prod=0.90.",
      "file": "specs/017/spec.md",
      "line": 67,
      "evidence": "spec.md AC-006: 'threshold relaxado de 90 para 85 em CI'. E15-S03 AC-006: 'score >= 0.9' sem distincao CI/prod. Divergencia documental sem risco tecnico — justificativa inline + risco #2 cobrem a decisao.",
      "recommendation": "Atualizar epics/E15/stories/E15-S03.md AC-006 para refletir CI=0.85 / prod=0.90 e eliminar a divergencia. Pode ser feito junto com o /slice-report 017 ou como correcao de documento standalone.",
      "reclassification_requested": false,
      "exception_granted": false
    }
  ],
  "evidence": {
    "checks": {
      "acs_measurable": true,
      "acs_testable": true,
      "acs_unambiguous": true,
      "out_of_scope_explicit": true,
      "dependencies_declared": true,
      "journey_covered": true,
      "risks_with_mitigation": true,
      "no_r1_r16_violations": true,
      "no_adr0015_conflict": true,
      "security_acs_present": true,
      "edge_cases_per_happy_ac": true
    },
    "acs_count": 14,
    "acs_happy": 6,
    "acs_edge": 6,
    "acs_security": 2,
    "story_contract_acs_mapped": {
      "E15-S03-AC-001": "spec AC-001 (happy) + AC-001-A (edge)",
      "E15-S03-AC-002": "spec AC-002 (happy) + AC-002-A (edge)",
      "E15-S03-AC-003": "spec AC-003 (happy)",
      "E15-S03-AC-004": "spec AC-004 (happy) + AC-004-A (edge)",
      "E15-S03-AC-005": "spec AC-005 (happy) + AC-005-A (edge)",
      "E15-S03-AC-006": "spec AC-006 (happy) + AC-006-A (edge) — threshold diverge CI/prod vs contrato",
      "E15-S03-AC-007": "spec AC-007 (seguranca) — renumerado de AC-SEC para sequencia continua"
    },
    "extra_acs_in_spec": {
      "AC-008": "Novo AC de seguranca (cache cleanup em upgrade) nao presente no contrato — adicao justificada, nao e omissao de escopo"
    },
    "harness_notation_validity": "AC-SEC renumerado como AC-007/AC-008 para satisfazer validador mecanico scripts/draft-spec.sh. Protocolo v1.2.4 nao proibe sequencia continua; a classificacao inline ('seguranca') e suficiente para rastreabilidade. Nao e debito de harness — e pratica aceitavel enquanto o script nao suportar prefixos AC-SEC nao numericos.",
    "out_of_scope_items": 6,
    "risks_documented": 4,
    "risks_with_mitigation": 4,
    "dependencies_declared": ["vite-plugin-pwa >= 0.20", "Workbox (transitiva)", "pwa-asset-generator >= 6.4", "mkcert (dev)", "lighthouse >= 11", "ADR-0015"],
    "adr0015_alignment": "PWA complementa Capacitor — spec explicita que testes webkit ficam para E15-S04 e experiencia iOS nativa usa wrapper Capacitor. Sem conflito com ADR-0015 decisao C (Ionic + Capacitor como estrategia principal).",
    "ambiguous_acs": [],
    "frontmatter_valid": true,
    "glossary_terms_unmapped": []
  }
}
