{
  "$schema": "gate-output-v1",
  "gate": "audit-spec",
  "slice": "015",
  "lane": "L3",
  "agent": "qa-expert",
  "mode": "audit-spec",
  "verdict": "approved",
  "timestamp": "2026-04-16T21:00:00Z",
  "commit_hash": "d520acf",
  "isolation_context": "slice-015-audit-spec-instance-02",
  "blocking_findings_count": 0,
  "non_blocking_findings_count": 2,
  "findings_by_severity": {"S1": 0, "S2": 0, "S3": 0, "S4": 1, "S5": 1},
  "findings": [
    {
      "id": "F-1",
      "severity": "S4",
      "severity_label": "minor",
      "gate_blocking": false,
      "description": "Formato de AC-ID usa 'AC-001..AC-006' em vez do formato canonico 'AC-NNN-XXX' definido em §10.1. Debito de harness conhecido: conflito entre protocolo §10.1 e validador mecanico scripts/draft-spec.sh que aceita apenas AC-001..AC-NNN. Classificado S4 conforme instrucao do orquestrador para este conflito especifico.",
      "file": "specs/015/spec.md",
      "line": null,
      "evidence": "ACs nomeados AC-001 a AC-006. Formato canonico seria AC-015-001 a AC-015-006.",
      "recommendation": "Resolver conflito entre protocolo §10.1 e scripts/draft-spec.sh via harness-learner. Quando resolvido, renomear ACs para formato canonico."
    },
    {
      "id": "F-2",
      "severity": "S5",
      "severity_label": "advisory",
      "gate_blocking": false,
      "description": "Termos tecnicos especializados (SQLCipher, Capacitor, Ionic, PWA, PoC) nao foram verificados contra glossary.md — acesso ao glossary.md nao permitido nesta instancia isolada (inputs restritos a spec-audit-input/). Advisory para verificacao externa.",
      "file": "specs/015/spec.md",
      "line": null,
      "evidence": "Instancia isolada nao tem acesso a glossary.md conforme R3. Termos sao tecnicos consagrados sem ambiguidade semantica aparente.",
      "recommendation": "Verificar glossary.md em contexto nao-isolado para confirmar mapeamento dos termos SQLCipher, Capacitor, Ionic, PWA, PoC."
    }
  ],
  "evidence": {
    "checks": {
      "acs_measurable": true,
      "acs_testable": true,
      "acs_unambiguous": true,
      "out_of_scope_explicit": true,
      "dependencies_declared": true,
      "journey_covered": true,
      "frontmatter_valid": true,
      "lane_present": true,
      "epic_field_present": true,
      "roadmap_consistency": true,
      "adr_consistency": true,
      "risks_have_mitigation": true
    },
    "acs_count": 6,
    "ambiguous_acs": [],
    "frontmatter_valid": true,
    "frontmatter_fields_present": ["slice", "story", "epic", "title", "lane", "status", "type", "dependencies", "reqs", "adrs"],
    "frontmatter_fields_missing": [],
    "glossary_terms_unmapped": [],
    "ac_id_format_found": "AC-001..AC-006",
    "ac_id_format_expected": "AC-NNN-XXX (debito harness)",
    "roadmap_consistency": true,
    "adr_consistency": true,
    "story_contract_coverage": {
      "AC-001": "coberto — mapeamento de endpoints E01/E02/E03",
      "AC-002": "coberto — versoes exatas de pacotes validadas por npm install",
      "AC-003": "coberto — issues SQLCipher iOS17+/Android14+ com decisao explicita",
      "AC-004": "coberto — tabelas com espelho local + tenant_id conforme ADR-0016",
      "AC-005": "coberto — descarte formal do frontend legado com comandos find verificaveis",
      "AC-006": "coberto — checklist de pre-condicoes para E15-S02"
    },
    "out_of_scope_coherent_with_spike_type": true,
    "risks_documented": 3,
    "risks_with_mitigation": 3,
    "evidences_mechanically_verifiable": true,
    "spike_type_coherence": {
      "no_production_code": true,
      "output_is_documents": true,
      "optional_poc_declared": true,
      "scope_restriction_explicit": true
    },
    "previous_iteration_findings_resolved": {
      "F-015-001_lane_missing": "RESOLVIDO — lane: L3 presente no frontmatter",
      "F-015-002_epic_missing": "RESOLVIDO — epic: E15 presente no frontmatter"
    }
  }
}
