{
  "$schema": "gate-output-v1",
  "gate": "functional-gate",
  "slice": "015",
  "lane": "L3",
  "agent": "product-expert",
  "mode": "functional-gate",
  "verdict": "approved",
  "timestamp": "2026-04-16T18:00:00Z",
  "commit_hash": "d520acf",
  "isolation_context": "slice-015-functional-gate-instance-01",
  "blocking_findings_count": 0,
  "non_blocking_findings_count": 2,
  "findings_by_severity": {
    "S1": 0,
    "S2": 0,
    "S3": 0,
    "S4": 2,
    "S5": 0
  },
  "findings": [
    {
      "id": "F-001",
      "severity": "S4",
      "severity_label": "minor",
      "gate_blocking": false,
      "description": "AC-002 exige 'npm install sem erros evidenciado por projeto temporário de PoC'. O npm-install.log é explicitamente um placeholder — nenhuma execução real de npm install ocorreu. A spec prevê alternativa 'OU equivalente documentado inline com output do comando', mas o inline contém justificativa de ambiente, não output real. A pendência está sinalizada no checklist como item obrigatório de E15-S02. O risco funcional é baixo: versões exatas estão declaradas em package.json e o executor sabe exatamente o que fazer (primeiro passo de E15-S02 documentado).",
      "file": "spike-inf007/npm-install.log",
      "line": 1,
      "evidence": "npm-install.log linha 9: 'Este log e um PLACEHOLDER'. stack-versions.md linha 21: 'Log de execução local do npm install não capturado'. spec.md linha 79: alternativa 'OU equivalente documentado inline em stack-versions.md com output do comando' — output não está presente.",
      "recommendation": "Em E15-S02, executar 'cd spike-inf007 && npm install 2>&1 | tee npm-install.log' como primeiro passo antes do scaffold, conforme já sinalizado no checklist de pré-condições. Substituir placeholder pelo log real e atualizar stack-versions.md seção 'Evidência npm install'."
    },
    {
      "id": "F-002",
      "severity": "S4",
      "severity_label": "minor",
      "gate_blocking": false,
      "description": "AC-003 exige que os issues do repositório @capacitor-community/sqlite sejam listados 'com data e status'. Os candidatos C1, C2, C3 estão todos marcados como 'a verificar' sem número de issue, data ou status confirmado — o documento admite ausência de acesso web ativo no ambiente do spike. O verdict '(a) sem bloqueador conhecido' é explicitamente preliminar. O plano B (D-1) está documentado com tecnologia alternativa concreta (libsodium/@noble/ciphers), custo e reversibilidade. O risco funcional é baixo: executor de E15-S02 tem instrução clara de re-verificar antes do scaffold.",
      "file": "docs/frontend/stack-versions.md",
      "line": 63,
      "evidence": "stack-versions.md linha 64: 'Restrição do spike: acesso web ativo não disponível na execução do spike'. Candidatos C1/C2/C3 com status 'a verificar' sem issue number ou data. AC-003 spec.md linha 50-51: 'lista pelo menos os issues relevantes abertos no repositório @capacitor-community/sqlite com data e status'.",
      "recommendation": "Em E15-S02, antes do scaffold, acessar https://github.com/capacitor-community/sqlite/issues com filtros 'iOS 17', 'Android 14', 'SQLCipher', 'encryption', 'crash' e atualizar a tabela com número de issue real, data de abertura e status atual. Se confirmado bloqueador: ativar plano B (D-1) e abrir emenda à ADR-0015 antes de continuar."
    }
  ],
  "evidence": {
    "summary": "6 ACs validados funcionalmente contra a jornada do executor de E15-S02. Artefatos entregues são acionáveis: api-endpoints.md tem tabelas completas com método+URL+auth+payload+response para todos os endpoints E01/E02/E03; stack-versions.md tem versões semver exatas, checklist com pendências explícitas, plano B documentado, descarte formal do frontend legado. 2 findings S4 (não-bloqueadores) registrados: npm install não executado empiricamente e issues SQLCipher sem número/data real — ambos sinalizados no checklist como obrigação de E15-S02.",
    "ac_verification": {
      "AC-001": {
        "happy_path": true,
        "error_paths": true,
        "multi_tenant": true,
        "rbac": true,
        "notes": "api-endpoints.md cobre 34 endpoints em 5 grupos (auth, tenants, lgpd, clientes, contatos, healthcheck). Método HTTP, auth header, payload e response documentados em tabela. Headers planejados para E15 (Authorization: Bearer + X-Tenant-Id) documentados. Débito FE-API-01 (ausência de routes/api.php) registrado com plano claro."
      },
      "AC-002": {
        "happy_path": true,
        "error_paths": false,
        "multi_tenant": true,
        "rbac": true,
        "notes": "Versões semver exatas declaradas em package.json e stack-versions.md. npm install não executado empiricamente — finding F-001 (S4). Fallback documentado em 4 níveis (aceitar warning, overrides, --legacy-peer-deps, emenda ADR). --force proibido explicitamente."
      },
      "AC-003": {
        "happy_path": true,
        "error_paths": true,
        "multi_tenant": true,
        "rbac": true,
        "notes": "Seção 'Riscos de plataforma' existe. Verdict (a)/(b) declarado explicitamente como preliminar. 3 candidatos listados. Issue numbers/datas ausentes — finding F-002 (S4). Plano B (D-1) documentado com tecnologia concreta e reversibilidade."
      },
      "AC-004": {
        "happy_path": true,
        "error_paths": true,
        "multi_tenant": true,
        "rbac": true,
        "notes": "Schema local: 11 tabelas com tenant_id declarado. Tabelas sem tenant_id (users, roles) explicadas. Tabelas não-espelhadas listadas com rationale. Nota crítica sobre tenant_id físico mesmo em dispositivo single-tenant (para troca de tenant sem wipe) está correta e útil."
      },
      "AC-005": {
        "happy_path": true,
        "error_paths": true,
        "multi_tenant": true,
        "rbac": true,
        "notes": "Seção 'Descarte' lista 20 Blades, 2 JS, 1 CSS com inventário completo. Exceções documentadas (emails transacionais: server-side, não descartados). Confirmação explícita de não-reaproveitamento. Livewire classes PHP mantidas no backend com rationale (fallback admin até E15-S07)."
      },
      "AC-006": {
        "happy_path": true,
        "error_paths": true,
        "multi_tenant": true,
        "rbac": true,
        "notes": "Checklist de 7 itens: 5 verificados [x], 2 com pendência explícita com owner declarado (quem executar E15-S02) e comando exato. Cobre versões, auth funcional, SQLCipher, descarte. Formato correto para spike de investigação offline."
      }
    },
    "tenants_tested": 0,
    "permission_levels_tested": [],
    "ui_tests_required": false,
    "ui_tests_passed": null,
    "scope_respected": true,
    "scope_notes": "Nenhum arquivo em app/, resources/, routes/, database/ alterado. spike-inf007/ é PoC descartável explicitamente não-produção. Decisões de design D-1/D-2/D-3 são úteis e acionáveis para o próximo executor.",
    "design_decisions_assessment": {
      "D-1": "Plano B concreto com libsodium/@noble/ciphers, chave PBKDF2, custo e reversibilidade declarados. Acionável.",
      "D-2": "Ordem de fallback para peer deps explícita (4 níveis, --force proibido). Acionável.",
      "D-3": "Rationale de tabela Markdown vs OpenAPI proporcional ao estágio. Caminho de conversão para Scramble/E17 documentado. Acionável."
    },
    "prerequisite_for_E15_S02_assessment": "5 de 7 itens do checklist verificados. 2 pendências explícitas com owner e instruções concretas. O executor de E15-S02 consegue iniciar sem surpresas de compatibilidade. Débito FE-API-01 (ausência de routes/api.php) registrado com plano de adaptação claro."
  }
}
