{
  "$schema": "gate-output-v1",
  "gate": "verify",
  "slice": "018",
  "lane": "L3",
  "agent": "qa-expert",
  "mode": "verify",
  "verdict": "approved",
  "timestamp": "2026-04-17T23:59:00Z",
  "commit_hash": "4cdfdee",
  "isolation_context": "slice-018-verify-instance-01",
  "blocking_findings_count": 0,
  "non_blocking_findings_count": 0,
  "findings_by_severity": {"S1": 0, "S2": 0, "S3": 0, "S4": 0, "S5": 0},
  "findings": [],
  "evidence": {
    "ac_results": [
      {"ac": "AC-001",   "status": "pass", "evidence": "tests/ci/test-regression-workflow.test.cjs — 7/7 passed"},
      {"ac": "AC-001-A", "status": "pass", "evidence": "tests/ci/test-regression-workflow.test.cjs — workflow nomeia AC violado explicitamente"},
      {"ac": "AC-002",   "status": "pass", "evidence": "tests/scripts/detect-shared-file-change.test.cjs + smoke-tests.test.cjs — 6+6=12/12 passed"},
      {"ac": "AC-002-A", "status": "pass", "evidence": "tests/scripts/detect-shared-file-change.test.cjs — shared_changed=false em docs/ e src/ nao-compartilhado"},
      {"ac": "AC-003",   "status": "pass", "evidence": "tests/scripts/validate-audit-prompt.test.cjs — 1st-pass: aceita fixture valida, rejeita sem output_contract"},
      {"ac": "AC-003-A", "status": "pass", "evidence": "tests/scripts/validate-audit-prompt.test.cjs — re-audit: rejeita foi_corrigido, finding-id previo, commit-hash adjacente a fix"},
      {"ac": "AC-004",   "status": "pass", "evidence": "tests/agents/contamination-refusal.test.cjs — 5 agent files com instrucao de recusa; fixture JSON nao contem evidence.ac_coverage_map"},
      {"ac": "AC-004-A", "status": "pass", "evidence": "tests/scripts/audit-set-difference.test.cjs — 7/7 passed; resolved/unresolved/new corretos; normalizacao de linha-num funcional"},
      {"ac": "AC-005",   "status": "pass", "evidence": "tests/scripts/validate-gate-output.test.cjs — valid-verify.json exit 0; validator le enum do schema (nao hardcoded)"},
      {"ac": "AC-005-A", "status": "pass", "evidence": "tests/agents/output-section-present.test.cjs — 5x4=20/20 passed; secao presente, literais corretos, JSON inline parseavel e conforme enum"},
      {"ac": "AC-006",   "status": "pass", "evidence": "tests/scripts/merge-slice-manifest.test.cjs — 6/6 passed; manifesto documenta pre-check + aliases legacy + relock-harness pelo PM"},
      {"ac": "AC-006-A", "status": "pass", "evidence": "tests/scripts/validate-gate-output.test.cjs — 3 fixtures invalidas rejeitadas com mensagem apontando campo violador (exit 1)"},
      {"ac": "AC-007",   "status": "pass", "evidence": "tests/agents/paths-section-present.test.cjs — 12/12 agent files com secao Paths, guardrail frontend/, instrucao Glob-antes-de-Read"},
      {"ac": "AC-007-A", "status": "pass", "evidence": "tests/scripts/check-forbidden-path.test.cjs — 9/9 passed; frontend/ backend/ mobile/ apps/ exit 1; src/ docs/ exit 0"}
    ],
    "dod_checklist": {
      "tests_pass": true,
      "lint_clean": true,
      "types_ok": true,
      "coverage_met": true,
      "no_files_out_of_scope": true
    },
    "node_test_exit_code": 0,
    "total_tests": 137,
    "total_passed": 137,
    "total_failed": 0,
    "test_files": 11,
    "artefacts_created": [
      ".github/workflows/test-regression.yml",
      "scripts/smoke-tests.sh",
      "scripts/detect-shared-file-change.sh",
      "scripts/check-forbidden-path.sh",
      "scripts/validate-audit-prompt.sh",
      "scripts/validate-gate-output.sh",
      "scripts/audit-set-difference.sh",
      "docs/protocol/audit-prompt-template.md",
      "docs/protocol/blocked-tokens-re-audit.txt",
      "docs/protocol/forbidden-paths.txt"
    ],
    "artefacts_updated": [
      "scripts/pre-push",
      "docs/protocol/06-estrategia-evidencias.md",
      ".claude/agents/ (12 agent files — secao Paths adicionada)",
      ".claude/agents/ (5 agent files — secao Saida obrigatoria adicionada)"
    ],
    "files_out_of_scope": []
  }
}
