{
  "$schema": "gate-output-v1",
  "gate": "plan-review",
  "slice": "016",
  "lane": "L3",
  "agent": "architecture-expert",
  "mode": "plan-review",
  "verdict": "approved",
  "timestamp": "2026-04-17T20:45:00Z",
  "commit_hash": "5306815",
  "isolation_context": "slice-016-plan-review-instance-02",
  "blocking_findings_count": 0,
  "non_blocking_findings_count": 0,
  "findings_by_severity": {"S1": 0, "S2": 0, "S3": 0, "S4": 0, "S5": 0},
  "findings": [],
  "evidence": {
    "checks": {
      "ac_to_module_mapping_complete": true,
      "alternatives_documented": true,
      "reversibility_declared": true,
      "adr_backed_where_needed": true,
      "adr_0001_consistency": true,
      "no_invented_requirements": true,
      "eager_loading_strategy_declared": true,
      "middleware_pipeline_explicit": true,
      "risks_with_mitigations": true,
      "cross_slice_dependencies_explicit": true,
      "migrations_safe_patterns": true,
      "controllers_are_routers": true
    },
    "acs_mapped_count": 14,
    "decisions_without_alternatives": [],
    "decisions_without_reversibility": [],
    "eloquent_relations_without_eager_loading": [],
    "routes_without_middleware": [],
    "decisions_evaluated": ["D1", "D2", "D3", "D4", "D5", "D6", "D7", "D8", "D9", "D10"],
    "risks_evaluated": ["R1", "R2", "R3", "R4", "R5", "R6", "R7", "R8", "R9", "R10"],
    "ac_coverage_map": {
      "AC-001": "tests/e2e/dev-server.spec.ts",
      "AC-002": "tests/node/build.test.mjs",
      "AC-003": "tests/node/cap-ios.test.mjs (skip non-darwin)",
      "AC-004": "tests/node/cap-android.test.mjs",
      "AC-005": "tests/node/dir-structure.test.mjs",
      "AC-006": "tests/e2e/layout.spec.ts",
      "AC-007": "tests/node/lint.test.mjs",
      "AC-008": "tests/node/legacy-removed.test.mjs",
      "AC-009": "tests/node/port-conflict.test.mjs",
      "AC-010": "tests/node/build-type-error.test.mjs",
      "AC-011": "tests/node/dir-structure.test.mjs (conjunto exato)",
      "AC-012": "tests/node/lint-violation.test.mjs",
      "AC-013": "tests/node/routes-clean.test.mjs",
      "AC-014": "tests/node/cap-config-prod.test.mjs"
    },
    "adr_references_in_plan": ["ADR-0015", "ADR-0016"],
    "cross_slice_deps": ["slice-015"],
    "na_justifications_accepted": {
      "schema_migrations": "slice sem DB/ORM (E15-S06 trata SQLite)",
      "api_contracts": "sem novas rotas backend; consumo de API existente",
      "eager_loading": "sem ORM no slice",
      "middleware_pipeline": "sem novas rotas de API; rota /health mantem middleware atual"
    },
    "f001_status_from_instance_01": "resolved — spec.md emendada: AC-008 declara exceção literal 'resources/views/emails/' (linhas 56-57) e AC-013 idem (linhas 73-74); 'Fora de escopo' (linha 87) preserva templates de e-mail transacional. Plan §3/§6/§16 agora são fiel reflexo da spec.",
    "summary": "Plan integro: 12/12 checks OK, 14/14 ACs mapeados, 10/10 decisoes com alternativas+reversibilidade, 10/10 riscos com mitigacao. Plan⊆spec apos emenda AC-008/AC-013."
  }
}
